1005c0279d46cf4bf6244e374afd5844|井冈山龙市镇会师纪念堂舞台灯光音响智能化采购项目|井冈山市中锦造价咨询有限公司 关于井冈山龙市镇会师纪念堂舞台灯光音响智能化采购项目 (招标编号 : 井政采字【 2019 】 95 号公告 依据确定的采购方式 , 井冈山市中锦造价咨询有限公司受 井冈山市龙市镇人民政府 委托,依据 井冈山市政府采购管理办公室 下达的采购计划,对 井冈山龙市镇会师纪念堂舞台灯光音响智能化采购项目 (招标编号 : 井政采字【 2019】 95 号 』进行 电子化公开 招标采购,欢迎符合资格条件的供应商投标。 一. 招标采购内容、数量及要求: 序号 货物名称 技术参数 数量 采购预算合计 (元) 最高限价 (元) 评审办法 1 舞台灯光配置 具体参数详见招标文件第五章 1 批 945120 916766.4 综合 评分法 2 舞台扩声配置 3 专业舞台幕布机械系统 4 舞台大幕显示系统 注:以上未注明原装进口产品的,均为国产产品,并且不允许提供进口产品参加投标。 本项目不接受联合 体投标,中标必须独立完成本项目,不得分包转包给第三方。 二、投标人的 资格条件 1、具有独立承担民事责任的能力 (提供在工商部门注册的有效 “企业法人营业执照或营业执照”原件或加盖投标人公章的复印件); 2、具有良好的商业信誉和健全的财务会计制度( 提供近三个月任意一月财务状况报告的相关证明材料或 2018年度财务审计报告原件或复印件加盖公章) 3、具有履行合同所必须的设备和专业技术能力 ( 投标人提供承诺函原件) 4、有依法缴纳税收和社会保障资金的良好记录 税务登记证 (提供开标前 6个月内任意一个月依法缴纳税收的纳税证明和社会保障资金的发票原件或复印件加盖公章) 5、参加政府采购活动前三年内,在经营活动中没有重大违法记录 ( 提供无重大违法记录承诺函原件) 6 、 本项目不接受联合体投标。 三、法律、行政法规规定的其他条件及项目特殊要求 7 、 单位负责人为同一人或者存在直接控股、管理关系的不同投标人,不得参加同一合同项下的采购活动。 8 、为采购项目提供整体设计、规范编制或者项目管理、监理、检测等服务的投标人不得参加该采购项目的采购活动。 9 、投标人被 “信用中国”网站列入失信被执行人和重大税收违法案件当事人名单的、被“中国政府采购网”网站列入政府采购严重违法失信行为记录名单(处罚期限尚未届满的),不得参与本项目的政府采购活动 ,开标 现场 网上 查验 . 特别提醒:供应商必须将以上材料的原件扫描件上传至电子版投标文件中,开标时必须提供以上 ( 1、2、3、4、5、) 资料证明材料作为资格审查,开标现场查验,未提供视为无效投标。 备注:供应商必须携带工商营业执照、税务登记证、组织机构代码证 (或三证合一的营业执照副本原件或加盖投标人公章的复印件)、法定代表人授权书及投标代表人身份证原件(如是法人参加则只需提供身份证原件)至开标现场查验 。 四、获取招标文件的时间和期限、地点、方式 1、有意向的投标人必须在江西省公共资源交易网(网址 注册并办理江西省CA数字证书和电子签章。具体要求详见“江西省政府采购网”。(网址 2、有意向的投标人可从2019年 11 月 02 日至 2019年11 月 24 日(北京 17 :00时间),在江西省公共资源交易网上报名和下载招标文件。 五、招标公告期限 自发布之日起 5个工作日。 六、投标截止时间及开标时间: 1、投标人必须在投标截止时间前将电子投标文件上传至江西省公共资源门户网站,逾期投标无效(投标人网上操作遇到问题可拨打客服电话400-980-0000)。 2、投标截止时间和开标时间为2019年 11 月 25 日 09 :3 0 时(北京时间)。届时请投标人的法人或经正式授权的代表携带 CA数字证书出席开标大会,签到时间以递交CA数字证书和纸质投标文件时间为准。 3、CA数字证书、纸质投标文件递交地点及开标地点: 江西省井冈山市公共资源交易中心(井冈山市电子信息产业园内市民中心主楼东三楼)。 七 、投标保证金: 投标保证金缴纳方式、户名、开户行、账号及金额详见招标文件。 八 、 上传了投标文件的供应商,如不能参加此次投标的,请在投标截止时间三日前以书面形式通知采购代理机构放弃投标;否则,不得再参加该项目的采购活动。 九 .政府采购政策: 本项目采购落实小微企业、监狱企业、 残疾人福利性单位、 节能、环保产品等政府采购政策,具体规定详见招标文件。 十 、 投标人可 自行安排到采购人处踏勘现场,地点: 井冈山龙市镇会师纪念堂 十 一 、 采购项目联系方式 采购人: 井冈山市龙市镇人民政府 采购人地址: 井冈山龙市镇会师纪念堂 联系人: 李明文 联系方式 :13979650208 采购代理机构名称:井冈山市中锦造价咨询有限公司 地址:井冈山市新城区映山红路 8 号 G4 栋 13 号 联系人:张女士 联系方式: 15779666333 电子邮箱: 157642766@QQ.COM 采购 单位: 井冈山市龙市镇人民政府 2019年 10 月 31 日|2
3aa82c5f7bdea546afae105dc761d273|亚行贷款河北省养老服务体系建设项目-保定蠡县养老综合服务中心项目-养老综合服务中心和十个日间照料中心土建施工合同|亚行贷款河北省养老服务体系建设项目-保定蠡县养老综合服务中心项目-养老综合服务中心和十个日间照料中心土建施工合同 基本信息 标段(包) 亚行贷款河北省养老服务体系建设项目-保定蠡县养老综合服务中心项目-养老综合服务中心和十个日间照料中心土建施工合同 所属行业: 卫生和社会工作/社会工作 所属地区: 保定市-蠡县 开标时间: 2019-10-09 09:00 开标地点: 河北省公共资源交易中心 公示开始日期: 2019-11-01 公示截止日期: 2019-11-06 中标候选人名单 排名 统一社会信用代码 中标候选人单位名称 投标价格 评标价格 评分结果 质量标准 工期/交货期 1 91130000104366517F 河北建工集团有限责任公司 121826289.99元人民币 121826289.99元人民币 - 符合国家要求 16个月 2 911309001095417407 大元建业集团股份有限公司 124310099.64元人民币 124310099.64元人民币 - 符合国家要求 16个月 3 91130100104400172D 石家庄一建建设集团有限公司 129658866.84元人民币 129658866.84元人民币 - 符合国家要求 16个月 备注: 第1中标候选人其他说明:无 第2中标候选人其他说明:无 第3中标候选人其他说明:无 第1中标候选人-项目负责人 职务 姓名 职称 执业或职业资格 证书编号 项目经理 张书更 工程师 一级注册建造师 冀113060700269 第1中标候选人-响应招标文件要求的资格能力条件 满足招标文件要求 第2中标候选人-项目负责人 职务 姓名 职称 执业或职业资格 证书编号 项目经理 纪俊宁 正高级工程师 一级注册建造师 冀113060802529 第2中标候选人-响应招标文件要求的资格能力条件 满足招标文件要求 第3中标候选人-项目负责人 职务 姓名 职称 执业或职业资格 证书编号 项目经理 张建同 高级工程师 一级注册建造师 冀113060701185 第3中标候选人-响应招标文件要求的资格能力条件 满足招标文件要求 提出异议渠道和方式 受理单位:中仪国际招标有限公司 联系人:廖先生 电话:010-63348619 邮箱 招标文件规定公示的其他内容 招标结果公示 项目名称:亚洲开发银行贷款河北省养老服务体系建设项目-保定蠡县养老综合服务中心项目-养老综合服务中心和十个日间照料中心土建施工合同(合同编号:LX-C01) 招标编号:0703-1920CIC5L015 序号 投标人名称 开标价格 (人民币元) 评标价格 (人民币元) 拒标理由 中标人的中标价 (人民币元) 合同范围描述 1 石家庄一建建设集团有限公司 129,658,866.84 122,490,613.84 评标价不为最低 不适用 本合同总建筑面积38814.71 ㎡,含1个养老综合服务中心(建筑面积31282.41㎡)、10个日间照料中心(建筑面积7532.30 ㎡)。主要施工内容包含蠡县养老综合服务中心项目的建筑、装饰装修、结构、室内给排水、暖通、照明供电、消防水池、室外给排水管线、道路绿化等的施工及其他工程。 2 河北建工集团有限责任公司 121,826,289.99 114,658,036.99 不适用 121,826,289.99 3 河南瑞华建筑集团有限公司 123,008,002.67 不适用 未通过完整性评审 不适用 4 大元建业集团股份有限公司 124,310,099.64 117,141,846.64 评标价不为最低 不适用 5 中余建设集团有限公司 141,089,297.88 不适用 未通过完整性评审 不适用 全部投标单位 河北建工集团有限责任公司、大元建业集团股份有限公司、石家庄一建建设集团有限公司、河南瑞华建筑集团有限公司、中余建设集团有限公司、 联系方式 招标人: 蠡县光荣院 招标代理机构: 中仪国际招标有限公司 联系人: 张先生 联系人: 廖先生 地址: 河北省保定市蠡县 地址: 北京市丰台区西三环中路90号通用技术大厦 电话: 0312-6211742 电话: 010-63348619 电子邮箱: YHLXYLXM@163.COM 电子邮箱 |4
675056e2e52cd1ba702f04e683ae148e|人力资源和社会保障基本情况入户调查购买物品合同公示|人力资源和社会保障基本情况入户调查购买物品采购合同公示 一、采购项目名称:人力资源和社会保障基本情况入户调查购买物品 二、采购项目编码:37010440100520190034 三、中标(成交)供应商:山东龙浦办公用品有限公司 地址:济南市槐荫区西郊机场拖机路东A型17号楼 联系人:满壁 联系方式:13953162175 四、合同金额:0.0792 万元 五、联系方式 1、采购人:济南市槐荫区人民政府营市街街道办事处 地址:营市东街6号 联系人:刘跃强 联系方式:87163034 2、代理机构:无 地址: 联系人: 联系方式: 附件:『人力资源和社会保障基本情况入户调查购买物品』 发布人:刘跃强 发布时间:2019年11月01日 11时51分39秒 相关信息|4
9804fd5599bb46ce8d8d722bd9bfbfc1|人力资源和社会保障局复印纸采购|招标正文 ﻿ * 、采购人: * 、采购项目编号: * 、采购项目名称: * 、采购品目名称: * 、采购预算金额(元): * 、采购数量: * 、需求时间: * 、采购方式: * 、备案时间: 发布人: 发布时间: 年 月 日 11|2
908c3a72645b450c8dbde1092127cf0f|人力资源和社会保障局硒鼓粉盒采购|招标正文 ﻿ * 、采购人: * 、采购项目编号: * 、采购项目名称: * 、采购品目名称: * 、采购预算金额(元): * 、采购数量: * 、需求时间: * 、采购方式: * 、备案时间: 发布人: 发布时间: 年 月 日 19|2
9e3508aada77a47e6af6842f8a5101c5|亿诚建设项目管理有限公司关于吉水县政务网络安全建设项目竞争性磋商招标公告|(定稿)吉水县政务网络安全建设项目.DOC 亿诚建设项目管理有限公司受吉水县人民政府办公室委托,依据吉水县政府采购管理办公室对采购计划备案,对其所需的货物和有关服务进行竞争性磋商采购,欢迎合格的供应商前来参加。 项目名称:吉水县政务网络安全建设项目 项目编号:YCJS-JA-19011 采购人联系方式: 采购人名称:吉水县人民政府办公室 采购人地址:吉水县行政中心北楼四楼 联系人:刘先生 联系电话:15979615087 采购代理机构联系方式: 采购代理机构名称:亿诚建设项目管理有限公司 采购代理机构地址:吉安市吉州区商会大厦22楼 联系人:杨女士 联系电话:0796-8286288 电子函件:YCJSJA@163.COM 采购项目预算:89.2万元 采购项目最高限价:89.2万元 一、采购人的采购需求 采购名称 简要说明 数量 采购项目编号 评分办法 吉水县政务网络安全建设项目 详见本磋商文件第五章 1批 吉购2019F000266092 综合评分法 详细清单 序号 货物名称 数量(台/套)/频率(次) 备注 1 安全网关 1 2 WEB应用防护系统 1 3 上网行为管理 1 4 日志审计 1 5 负载均衡 1 6 网页防篡改软件 1 7 监控及摄像头 1 8 PDU机柜电源 10 9 门禁设备 1 10 安全服务项目 系统安全评测1次 协助应急预案制定1次 协助应急演练1次 服务期内突发事件应急响应1次 《中华人民共和国网络安全法》、网络安全等级保护等相关要求 11 等级保护测评 1 二、供应商的资格要求 (1)供应商须为在中华人民共和国境内注册的,具有独立承担民事责任能力的法人或其他组织(提供在工商部门注册的有效“企业法人营业执照或营业执照”原件或加盖公章的复印件);(现场展示) (2)具有良好的商业信誉和健全的财务会计制度(提供开标前6个月内任意一个月的财务报表(资产负债表和利润表)或近二年内任意一年经审计的财务状况报告或近三个月内基本开户银行出具的资信证明原件或加盖公章的复印件); (3)具有履行合同所必需的设备和专业技术能力(提供书面承诺函原件); (4)有依法缴纳税收和社会保障资金的良好记录(提供开标前6个月内任1个月依法缴纳税收和社会保障资金的证明文件原件或复印件加盖公章,依法免税或不需要缴纳社会保障资金的投标人,须提供相应证明文件); (5)参加政府采购活动前三年内,在经营活动中没有重大违法记录(提供投标人的书面承诺函原件); (6)供应商须提供法定代表人授权委托书原件,被授权人身份证原件;(现场展示) (7)法律、行政法规规定的其他条件及项目特殊要求 1、单位负责人为同一人或者存在直接控股、管理关系的不同供应商,不得参加同一合同项下的采购活动。 2、为采购项目提供整体设计、规范编制或者项目管理、监理、检测等服务的供应商不得参加该采购项目的采购活动。 3、供应商被“信用中国”网站列入失信被执行人和重大税收违法案件当事人名单的、被“中国政府采购网”网站列入政府采购严重违法失信行为记录名单(处罚期限尚未届满的),不得参与本项目的政府采购活动。供应商应当将通过“信用中国”和“中国政府采购网”网站的查询结果加盖单位公章在磋商响应文件中体现,查询记录截图时间为磋商响应截止时间前7日内有效。 4、提交产品属于政府强制采购节能产品、环境标志产品品目清单的,必须为本公告发布之日前最新一期《节能产品政府采购品目清单》、《环境标志产品政府采购品目清单》的产品; 5、本项目是否接受联合体参加磋商:不接受。 三、获取磋商文件的时间和期限、地点、方式 有意向的供应商请于 2019年11月2日至2019年11月11日,在江西省公共资源交易网、吉安政府采购网或吉安市公共资源交易网自行下载磋商文件(包括澄清、修改等),并按竞争性磋商文件要求编制竞争性磋商响应文件,在规定的时间准时参加磋商会。 四、响应文件递交截止时间和磋商时间为2019年11月12日9:30时(北京时间)。 五、响应文件递交地点和磋商地点:吉安市公共资源交易中心吉水县分中心(江西省吉安市吉水县万里大道与再兴路交叉口吉水县市民服务中心2楼)中开标厅 六、磋商保证金 磋商保证金缴纳方式、户名、开户行、账号及金额详见磋商文件。 七、采购代理服务费 本项目采购代理服务费:向成交供应商收取,收费标准详见磋商文件。 亿诚建设项目管理有限公司 2019年11月1日|2
3e6f1a4f4a78fb0f7adc65007fdd9686|仁化县河长制服务类综合性工作采购项目更正/变更公告|仁化县河长制服务类综合性工作采购项目更正/变更公告 信息来源:广东省政府采购网 发布机构: 韶关市公共资源交易中心 发布日期:2019-11-01 11:06:59 采购项目编号: 440224-201910-F8-2016-907001-0022 采购品目:水利管理服务 预算金额: 16,939,200.00 元 代理机构:韶关市公共资源交易中心 项目负责人:华玉英 项目经办人:张清华 韶关市公共资源交易中心 于2019年10月28日 在广东省政府采购网上提交的 仁化县河长制服务类综合性工作(440224-201910-F8-2016-907001-0022)(公开招标、邀请招标、竞争性谈判、询价、竞争性磋商)采购公告, 因内容调整原因,现将原公告部分内容作如下更正/变更: 原招标文件: 第六部分 投标文件格式 温馨提示: 1.本部分仅供参考。 6.供应商应当编制投标文件一式五份,其中正本一份和副本四份(投标文件的副本可采用正本的复印件)。 现更改为: 第六部分 投标文件格式 温馨提示: 1.本部分仅供参考。 2.供应商应当编制投标文件一式七份,其中正本一份和副本六份(投标文件的副本可采用正本的复印件)。 其他内容不变。 二、投标(响应)截止时间:2019年11月26日09时30分 三、联系事项 (一)采购项目联系人(代理机构):张先生 联系电话:0751-6283651 采购项目联系人(采购人):黄先生 联系电话:0751-6800393 (二)采购代理机构 :韶关市公共资源交易中心 地址:韶关市武江区西联镇韶关市公共资源交易中心 联系人:陈磊 联系电话:0751-8379615 传真:0751-8379615 邮编:512029 (三)采购人:仁化县水务局 地址:仁化县建设路44号 联系人:柳燕华 联系电话:0751-6352328 传真:0752-6352328 邮编:512300 特此公告。 发布人:韶关市公共资源交易中心 发布时间:2019年11月01日 免责声明: 本页面提供的内容是按照政府采购有关法律法规要求由采购人或采购代理机构发布的,广东省政府采购网对其内容概不负责,亦不承担任何法律责任。 你的位置 : 首页 > 更正公告 >公开招标 访问次数:1 次 相关信息 2019-10-28 11:25 仁化县 水利管理服务 仁化县河长制服务类综合性工作采购项目公开招标公告|3
88febaf3f22176c473bf15e98a1c2c03|介休市城关乡彦博小学办公家具成交公告|公告信息: 采购项目名称 办公家具 品目 货物/家具用具/其他家具用具 采购单位 介休市城关乡彦博小学 行政区域 介休市 公告时间 2019年11月01日 10:41 本项目招标公告日期 2019年10月25日 成交日期 2019年11月01日 谈判小组、询价小组成员、磋商小组成员名单及单一来源采购人员名单 邵维忠、贾炳俊、马文强 总成交金额 ￥1.792500 万元(人民币) 联系人及联系方式: 项目联系人 罗斌 项目联系电话 0354-7229001 采购单位 介休市城关乡彦博小学 采购单位地址 介休市 采购单位联系方式 郭沁宾13834859066 代理机构名称 介休市政府采购中心 代理机构地址 “市民之家”西大街77号三层 代理机构联系方式 罗斌0354-7229001 附件: 附件1 山西省介休市政府采购中心关于办公家具成交公告078.DOC 介休市政府采购中心受介休市城关乡彦博小学的委托,就“办公家具”项目(项目编号:JXZCA—2019078)组织采购,评标工作已经结束,成交结果如下: 一、项目信息 项目编号:JXZCA—2019078 项目名称:办公家具 项目联系人:罗斌 联系方式:0354-7229001 二、采购单位信息 采购单位名称:介休市城关乡彦博小学 采购单位地址:介休市 采购单位联系方式:郭沁宾13834859066 三、采购代理机构信息 采购代理机构全称:介休市政府采购中心 采购代理机构地址:“市民之家”西大街77号三层 采购代理机构联系方式:罗斌0354-7229001 四、成交信息 招标文件编号:JXZCA—2019078 本项目招标公告日期:2019年10月25日 成交日期:2019年11月01日 总成交金额:1.7925 万元(人民币) 成交供应商名称、地址及成交金额: 包号 项目 供应商名称 价格(元) 一 办公家具 山西轩美办公家俱有限公司 17925 本项目代理费总金额:0.0 万元(人民币) 本项目代理费收费标准: 无 谈判小组、询价小组、磋商小组成员名单及单一来源采购人员名单: 邵维忠、贾炳俊、马文强 五、项目用途、简要技术要求及合同履行日期: 1.4米办公桌2支、办公椅100支、三节柜3组、会议条桌12支、主席台条桌5支、发言台1支(预算金额3.36万元) 六、成交标的名称、规格型号、数量、单价、服务要求: 无 七、其它补充事宜 无|4
a6d30c10516a099a241d773512e3cc71|介休市食品安全委员会办公室明厨亮灶智能监管系统项目成交公告|介休市食品安全委员会办公室明厨亮灶智能监管系统项目成交公告 2019年11月01日 11:22 来源:中国政府采购网 【打印】 【显示公告正文】【显示公告概要】 公告概要: 公告信息: 采购项目名称 明厨亮灶智能监管系统项目 品目 货物/通用设备/计算机设备及软件/其他计算机设备及软件 采购单位 介休市食品安全委员会办公室 行政区域 介休市 公告时间 2019年11月01日 11:22 本项目招标公告日期 2019年10月21日 成交日期 2019年11月01日 谈判小组、询价小组成员、磋商小组成员名单及单一来源采购人员名单 韩旭军、郝慧萍、武志斌 总成交金额 ￥67.000000 万元(人民币) 联系人及联系方式: 项目联系人 罗斌 项目联系电话 0354-7229001 采购单位 介休市食品安全委员会办公室 采购单位地址 介休市 采购单位联系方式 武志斌13293805677 代理机构名称 介休市政府采购中心 代理机构地址 山西省介休市政府采购中心(“市民之家”西大街77号三层) 代理机构联系方式 罗斌0354—7229001 介休市政府采购中心受介休市食品安全委员会办公室的委托,就“明厨亮灶智能监管系统项目”项目(项目编号:JXZCA—2019069-2)组织采购,评标工作已经结束,成交结果如下: 一、项目信息 项目编号:JXZCA—2019069-2 项目名称:明厨亮灶智能监管系统项目 项目联系人:罗斌 联系方式:0354-7229001 二、采购单位信息 采购单位名称:介休市食品安全委员会办公室 采购单位地址:介休市 采购单位联系方式:武志斌13293805677 三、采购代理机构信息 采购代理机构全称:介休市政府采购中心 采购代理机构地址:山西省介休市政府采购中心(“市民之家”西大街77号三层) 采购代理机构联系方式:罗斌0354—7229001 四、成交信息 招标文件编号:JXZCA—2019069-2 本项目招标公告日期:2019年10月21日 成交日期:2019年11月01日 总成交金额:67.0 万元(人民币) 成交供应商名称、地址及成交金额: 包号 项目 供应商名称 价格(元) 一 明厨亮灶智能监管系统项目 中国联合网络通信有限公司晋中市分公司 670000 本项目代理费总金额:0.0 万元(人民币) 本项目代理费收费标准: 无 谈判小组、询价小组、磋商小组成员名单及单一来源采购人员名单: 韩旭军、郝慧萍、武志斌 五、项目用途、简要技术要求及合同履行日期: 明厨亮灶监督管理平台 1套、平台服务器2台、视频存储服务器1台、西部数据企业级硬盘48个、核心交换机1台、UPS1台、蓄电池16块、电池柜1个、机柜2个、防火墙1台、安装测试费1批、专线(预算金额70万)。 六、成交标的名称、规格型号、数量、单价、服务要求: 无 七、其它补充事宜 无|4
44c9d995bed09afa359997564ebd9b5e|仲恺农业工程学院城建学院综合专业实验室建设项目(项目编号：0835-190Z12307091)更正公告|广东元正招标采购有限公司 于2019年10月31日 在广东省政府采购网上提交的 城建学院综合专业实验室建设项目(440000-201909-156015-0217)(公开招标)采购公告, 因公告附件上传有误的原因,现将原公告部分内容作如下更正/变更: 一、原招标文件内容: 原招标公告中的附件上传有误。 现更正重新上传,以此为准。 附件 1、委托代理协议:委托代理协议 2、招标文件:招标文件 注:原招标文件内容涉及上述内容的,均作出相应调整,其他内容不变。已报名获取招标文件的投标人须书面(传真)确认已获悉更正公告,不论投标人是否书面确认,本更正公告一经指定媒体发出,视为有效送达。 其他内容不变。 二、投标(响应)截止时间:2019年11月21日09时30分 三、联系事项 (一)采购项目联系人(代理机构):陈小姐 联系电话:020-87258495 采购项目联系人(采购人):林老师 联系电话:020-89003072 (二)采购代理机构 :广东元正招标采购有限公司 地址:广东省广州市越秀区先烈中路102号华盛大厦北塔26楼2608房 联系人:陈小姐、黄先生 联系电话:020-87258495-105 传真:020-87284598 邮编:510075 (三)采购人:仲恺农业工程学院 地址:广州市海珠区东沙街24号 联系人:林老师 联系电话:020-89003072 传真:020-89003975 邮编:510225 特此公告。 发布人:广东元正招标采购有限公司 发布时间:2019年11月01日|3
