1690ad6016916a74781330dabc1dd95e|伊川县城关街道办绿化喷洒车|公告内容文档 一、采购项目名称:伊川县城关街道办绿化喷洒车 二、采购项目编号:伊政自采【2019】010号 合同编号:伊政自采【2019】010号-A 三、中标(成交)供应商:郓城瑞洪环卫设备制造有限公司 地址:山东省菏泽市郓城县张营镇闫庄村村东 联系人:张宪辉 联系方式:15054081366 四、合同金额:78700 元 五、联系方式 1. 采购人:伊川县人民政府城关街道办事处 地址:伊川县人民东路209号 联系人:孙俊锋 联系方式:13703881699 2.采购代理机构: 地址: 联系人: 联系方式: 发布人:张伟丽 发布时间:2019年11月01日|4
6ee39699def71291da53d3ae6b639597|体腔热灌注治疗系统等医疗设备采购项目|体腔热灌注治疗系统等医疗设备采购项目2019-11-01 体腔热灌注治疗系统等医疗设备采购项目 发布时间:2019-11-01信息来源:福建省公共资源交易中心原文链接地址 1、项目名称: 体腔热灌注治疗系统等医疗设备采购项目 2、项目编号: [3500]FJTH[GK]2019103 3、采购人名称: 福建医科大学附属第二医院 地址: 福建省泉州市中山北路34号 项目负责人: 李勤 联系电话: 059522770853 4、代理机构名称: 福建省天海招标有限公司 地址: 福州市鼓楼区福建省福州市鼓楼区湖东路99号标力大厦12层 评审部经办人: 吴彬彬1 联系电话: 0591-87878462-819/816 5、招标公告日期: 2019-10-09 6、招标结果确定日期: 2019-10-31 7、资格性及符合性审查情况: 各投标人均通过资格及符合性审查。 8、中标情况: 包1 合同包 品目号 品目编号 品目名称 商品名称 品牌 规格型号 数量 单价 总价 1 1-1 A032019 体外循环设备 血液透析机 费森尤斯 4008S VERSIO V1O 6 136800元 820800元 1 1-2 A032019 体外循环设备 血液透析滤过机 费森尤斯 5008S 3 215000元 645000元 1 1-3 A032019 体外循环设备 连续性血液净化装置(CRRT) 旭化成 PLASAUTO Σ 1 629800元 629800元 服务要求或标的的基本概况 1-1免费质量保修期为最终验收合格之日起2年。 1-2免费质量保修期为最终验收合格之日起2年。 1-3免费质量保修期为最终验收合格之日起2年。 中标供应商名称 福建高品医疗科技有限公司 中标供应商地址 福建省泉州市丰泽区东湖街道齐云路126号主楼一楼 中标金额 2095600.00元 9、收费金额:2.70516万元 收费标准:本项目采购代理服务费由采购代理机构按中标金额的差额定率累进法计算:100万元以下按1.5%,100-500万元按1.1%,500-1000万元按0.8%,向中标人收取。招标代理服务费专户:账户名称:福建省天海招标有限公司三明分公司,开户行:中国建设银行股份有限公司永安支行,账号:35050164600700000037 10、其他(协议供货、定点采购项目信息):/ 11、评标委员会成员名单 采购人代表: 周雅虹 (包1) 评审专家: 严志业,张晶,欧琳,黄妙云 12、公告期限为本公告之日起1个工作日。 福建省天海招标有限公司 2019年11月01日|4
19c3ac98bb3948d0e291e866072bc500|佛山市公安局援建新疆伽师县公安局民警健康管理设备更正公告|广东采联采购科技有限公司 于2019年10月31日 在广东省政府采购网上提交的 援建新疆伽师县公安局民警健康管理设备(440600-201910-204001-0162)(竞争性磋商)采购公告, 因竞争性磋商公告中部分信息有误原因,现将原公告部分内容作如下更正/变更: 1. 原竞争性磋商公告中 “九、提交谈判(磋商、询价)文件地点:广州市环市东路472号粤海大厦23楼”更正为“佛山市季华五路55号万科金融中心33楼3303室。” 2.原竞争性磋商公告中 “十一、谈判(磋商、询价)地点:(详细地址) 广州市环市东路472号粤海大厦23楼”变更为“佛山市季华五路55号万科金融中心33楼3303室。” 其他内容不变。 二、投标(响应)截止时间:2019年11月11日14时30分 三、联系事项 (一)采购项目联系人(代理机构):江小姐 联系电话:0757-83205203-310 采购项目联系人(采购人):罗杰 联系电话:0757-83282648 (二)采购代理机构 :广东采联采购科技有限公司 地址:广州市环市东路472号粤海大厦23楼 联系人:梁群燕 联系电话:020-87651688-688 传真:020-87651698 邮编:510075 (三)采购人:佛山市公安局 地址:佛山市岭南大道北8号 联系人:余先生 联系电话:0757-83336888 传真:0757-83281582 邮编:528000 特此公告。 发布人:广东采联采购科技有限公司 发布时间:2019年11月01日|3
36c45f8c03e8cb865fbe71e5f1bb654f|佛山市高明区交通运输综合服务中心2019年高明区道路交通安全隐患路段治理工程（中心城区）竞争性磋商|佛山市高明区交通运输综合服务中心2019年高明区道路交通安全隐患路段治理工程(中心城区)竞争性磋商 2019年11月01日 11:38 来源: 【打印】 公告概要: 公告信息: 采购项目名称 佛山市高明区交通运输综合服务中心2019年高明区道路交通安全隐患路段治理工程(中心城区)竞争性磋商 品目 采购单位 佛山市高明区交通运输综合服务中心 行政区域 佛山市 公告时间 2019年11月01日 11:38 获取磋商文件时间 2019年11月04日 09:00至2019年11月08日 17:30 获取磋商文件地点 佛山市高明区荷城街道东华路70号三楼,即高明沃尔玛对面 响应文件递交时间 2019年11月04日 09:00至2019年11月14日 09:30 响应文件递交地点 广东展诚工程咨询有限公司佛山分公司(详细地址:佛山市高明区荷城街道东华路70号二楼开标室) 响应文件开启时间 2019年11月14日 09:30 响应文件开启地点 广东展诚工程咨询有限公司佛山分公司(详细地址:佛山市高明区荷城街道东华路70号二楼评标室) 联系人及联系方式: 项目联系人 朱先生 项目联系电话 0757-88687172 采购单位 佛山市高明区交通运输综合服务中心 采购单位地址 佛山市高明区荷城街道荷富路829号 采购单位联系方式 佛山市高明区交通运输综合服务中心 代理机构名称 广东展诚工程咨询有限公司 代理机构地址 广东省佛山市三水区西南街道广海大道中50号三层 代理机构联系方式 0757-87729978 广东展诚工程咨询有限公司 受 佛山市高明区交通运输综合服务中心 的委托,拟对 2019年高明区道路交通安全隐患路段治理工程(中心城区) 进行竞争性磋商,欢迎符合资格条件的供应商参加。本项目将优先确定符合相应资格条件的自主创新产品、节能产品、环保产品供应商参加谈判。 一、采购项目编号:440607-201911-1069-0007 二、采购项目名称:2019年高明区道路交通安全隐患路段治理工程(中心城区) 三、采购项目预算金额(元):1,403,601.73 四、采购数量:1批 五、项目内容及需求: (采购项目技术规格、参数及要求,需要落实的政府采购政策) 详见竞争性磋商文件。 六、供应商资格: 1. 供应商应具备《中华人民共和国政府采购法》第二十二条规定的条件: 1) 具有独立承担民事责任的能力; 2) 具有良好的商业信誉和健全的财务会计制度; 3) 具有履行合同所必需的设备和专业技术能力; 4) 有依法缴纳税收和社会保障资金的良好记录(含拟投入本项目人员社保证明); 5) 参加政府采购活动前三年内,在经营活动中没有重大违法记录; 6) 法律、行政法规规定的其他条件。 2. 供应商须是中国大陆境内注册的独立法人机构或其他组织,具有从事本项目的能力; (若供应商为银行、保险、石油石化、电力、电信等国有行业特殊情况的,可由其分支机构参与,但须持有上级公司出具的有效授权委托书,分支机构可沿用其上级公司或总公司的相关企业资质、人员证书、同类业绩;同一上级公司的两个分支机构不得同时参加投标。) 3. 参加投标的供应商代表必须是法人代表或法人授权代表; 4. 投标人须具有承接本工程所需的市政公用工程施工总承包三级以上(含三级)资质; 5. 投标人须持有有效的《安全生产许可证》; 6. 投标人应有良好信誉,参加城市道路工程投标的投标人,应成功申请进入城市道路诚信系统,即已获得城市道路诚信编号,且诚信档案处于有效范围。根据佛山市交通运输局《佛山市交通运输局关于认真贯彻落实<城市道路建设和养护行业诚信管理办法>的通知》(佛交[2014]347号)文件要求投标人必须加入佛山市城 市道路建设和养护行业诚信管理系统并且最新考评等级为C或以上,或新登记入库的。投标人的企业诚信档案信息以开标评标当天查询的结果为准。须提供城市道路诚信档案网页打印件加盖单位公章,如不能提供则可以用佛山市公共资源交易信息化综合平台投标企业信息数据库网上查询打印件并加盖投标人公章代替。城市道路诚信档案处于有效范围,是指城市道路诚信等级为C级或以上的,且未被系统锁定; 7. 投标人未被列入“信用中国”网站 记录失信被执行人或重大税收违法案件当事人名单或政府采购严重违法失信行为”记录名单;不处于中国政府采购网(WWW.CCGP.GOV.CN)“政府采购严重违法失信行为信息记录”中的禁止参加政府采购活动期间。(以采购代理机构于投标截止日当天在“信用中国”网站 及中国政府采购网(WWW.CCGP.GOV.CN)查询结果为准,如相关失信记录已失效,投标人需提供相关证明资料); 8. 对拟派项目负责人须具备注册于投标人本单位的市政公用工程专业二级(或以上级)注册建造师执业资格证书或临时注册建造师执业资格证书(在外省注册的建造师必须是一级注册建造师),且必须为本单位在职人员,并持有有效的《安全生产考核合格证(B证)》(广东省内投标人可提供“广东省建筑施工企业管理人员安全生产考核信息系统”的证书查询信息网页打印件)。需提供投标人近半年(扣除发布招标公告当月往前顺推6个月)为拟派项目负责人缴纳社保资金的有效的社保证明材料。以投标人(或其分支机构)所属当地社保管理部门出具的证明材料的原件或复印件为准; 9. 专职安全人员1名,均须具有《安全生产考核合格证(C证)》(广东省内投标人可提供“广东省建筑施工企业管理人员安全生产考核信息系统”的证书查询信息网页打印件),且为投标单位在职人员。需提供投标人近半年(扣除发布招标公告当月往前顺推6个月)为拟派专职安全人员缴纳社保资金的有效的社保证明材料。以投标人(或其分支机构)所属当地社保管理部门出具的原件或复印件为准; 10. 本项目不接受联合体参加投标; 11. 为采购项目提供整体设计、规范编制或者项目管理、监理、检测等服务的供应商,不得再参加该采购项目的其他采购活动。 七、符合资格的供应商应当在 2019 年11 月04 日 至 2019 年 11 月 08 日 期间(上午09:00至12:00,下午14:30至17:30,法定节假日除外,不少于5个工作日)到(广东展诚工程咨询有限公司)(详细地址:佛山市高明区荷城街道东华路70号三楼,即高明沃尔玛对面)购买谈判(磋商、询价)文件,谈判(磋商、询价)文件每套售价 300 元(人民币),售后不退。 八、提交谈判(磋商、询价)文件截止时间:2019 年11 月14 日09 时30 分 九、提交谈判(磋商、询价)文件地点:广东展诚工程咨询有限公司佛山分公司(详细地址:佛山市高明区荷城街道东华路70号二楼开标室) 十、谈判(磋商、询价)时间:2019 年11 月14 日09 时30 分 十一、谈判(磋商、询价)地点:(详细地址) 广东展诚工程咨询有限公司佛山分公司(详细地址:佛山市高明区荷城街道东华路70号二楼评标室) 十二、本公告期限 (3个工作日)自2019 年 11 月 04 日 至 2019 年 11 月 06 日 止。 十三、联系事项 (一)采购项目联系人(代理机构):江先生,谭小姐 联系电话:0757-88630279 采购项目联系人(采购人):朱先生 联系电话:0757-88687172 (二)采购代理机构 :广东展诚工程咨询有限公司 地址:广东省佛山市三水区西南街道广海大道中50号三层 联系人:李燕婷 联系电话:0757-87729978 传真:0757-87729978 邮编:528100 (三)采购人:佛山市高明区交通运输综合服务中心 地址:佛山市高明区荷城街道荷富路829号 联系人:林宇靖 联系电话:0757-88660528 传真:0757-8860528 邮编:528500 附件 1、委托代理协议:委托代理协议 2、竞争性谈判(磋商)文件/询价通知书:竞争性谈判(磋商)文件/询价通知书 发布人:广东展诚工程咨询有限公司 发布时间:2019年11月01日|2
3fcb1056148b290bac116b5cb37dbcbe|便携式防空导弹飞行性能监测设备采购竞争性谈判公告|便携式防空导弹飞行性能监测设备采购竞争性谈判公告 发布时间:2019-11-01 对接截止时间:2019-11-07 点击数:1 项目 概要 中国人民解放军某部队计划对便携式防空导弹飞行性能监测设备采购组织竞争性谈判,欢迎符合要求的供应商参与谈判报价。 主要 内容 一、主要内容: 1.项目名称:便携式防空导弹飞行性能监测设备采购 2.项目编号:TQS-XA-201910-JT-12 3. 采购人名称:中国人民解放军某部队 4. 项目预算:人民币110万元 5. 采购内容:便携式防空导弹飞行性能监测设备 6.数量:1套 二、供应商资格要求: 1.在中华人民共和国境内,依照《中华人民共和国公司法》注册的、具有独立法人资格的投标人; 2.具有良好的商业信誉和健全的财务会计制度; 3.具有依法缴纳税收和社会保障资金的良好记录; 4.参加本次采购活动前三年内,在经营活动中没有重大违法记录; 5.具有履行合同所必需的独立设备和独立专业技术能力; 6.法律、行政法规规定的其他条件。 7.本项目不接受联合体投标; 8.资质要求: (1)具备武器装备科研生产单位三级(含)以上保密资格; (2)具有武器装备质量管理体系认证证书; (3)有该类产品的设计经验,并承担过同类任务者优先。 三、领取谈判文件 1.领取时间: 2019年10月30日至 2019年11月7日,北京时间上午 8 时 00 分至下午 18 时 00 分(周一至周六为工作日,周日休息)。 2.领取地点:陕西西安市新城区金花北路16号或河北石家庄市新华区北新街169号。(注:领取时请提前电话联系确定具体领取地点) 3.领取方式:供应商指定专人到现场免费领取。领取前需接收采购人组织的资格审查,提供以下材料: (1)法定代表人授权书; (2)被授权人身份证复印件(加盖公章,现场核对原件); (3)单位资质证明文件(复印件加盖公章)。 四、报价文件的递交 报价文件递交的截止时间为 2019年11月9日9时 00 分。供应商应安排专人将报价文件现场提交到河北石家庄市新华区北新街169号万戎中心二楼第四会议室,逾期送达的报价文件将被拒绝。 五、谈判时间与地点 本次谈判报价时间同报价文件递交截止时间为同一时间,报价人的法定代表人或其委托的代理人应准时参加。河北石家庄市新华区北新街169号万戎中心二楼第六会议室。如有变更,另行通知。 六、其他要求 1.至谈判文件发放截止时间,若潜在响应单位超过5个,采购单位将保留进行资格审查的权力,如进行资格审查,仅有通过资格审查评审推荐出的潜在报价单位具备谈判资格。 2.如参与报价的供应商不足2家时,采购人将中止本项目采购。待项目再次公告后参与报价的供应商仍不足2家时,经谈判小组认定参加谈判的供应商符合条件,可转为单一来源谈判。 七、联系方式 联系人一(机关):谢参谋 电话:13931996406/029-84755013 联系人二(机关):裴高工 电话:13649241878 联系人(技术要求咨询):宋高工 电话:13932156671/031181563175 传真:029-84755557 电子邮件:CGB63908@163.COM 地址:陕西省西安市新城区金花北路16号 邮编:710032 参与 招标 因有效期等原因,参与招标功能已关闭! 参与 招标 请 登录 您不是认证用户,不具备参与招标的权限! 参与招标 当前状态: 参与招标时间: 查看更多> 单位名称: * 联系人姓名: * 联系电话: * 产品(技术)名称: * 产品(技术)简介: * 查看参与招标对接情况 离散元强度准则考核、数值模拟软 雷达器材货架购置招标公告 声明:本内容由军队相关单位提供,任何媒体、互联网站和商业机构不得擅自转载。|2
85c0cafa1934a2f4afeb1430c701c608|保兴垾板城垾汇水区域小区雨污分流及混接整治(赭山中心皖医小区等16个小区雨污分流改造)施工监理|保兴垾板城垾汇水区域小区雨污分流及混接整治(赭山中心皖医小区等16个小区雨污分流改造)施工监理 [2019-10-30] 项目名称: 保兴垾板城垾汇水区域小区雨污分流及混接整治(赭山中心皖医小区等16个小区雨污分流改造)施工监理 抽取库类别名称: 芜湖市政府性投资市政工程限额以下监理服务单位协议库(甲级) 委托抽取单位: 芜湖市镜湖区赭山公共服务中心 公示日期: 2019年10月30日 中标单位: 大鹏工程管理有限公司;|4
4e2dbb9d2ce34cd9886b5608395daea2|保卫、消防劳保用品采购流标|位置> 千里马招标网> 招标中心> 保卫、消防劳保用品采购流标 保卫、消防劳保用品采购流标 吉林- 长春- 长春市 状态:结果 加入收藏 打印 导出为 WORD EXCEL 更新时间: 2019年11月01日 招标单位: 立即查看 截止时间: 立即查看 招标编号: 立即查看 项目名称: 立即查看 代理机构: 立即查看 关键信息: 消防 劳保用品 招标文件: 立即查看 下文中****为隐藏内容,仅对千里马会员用户开放,【注册/登录】后可查看内容详情 保卫、消防劳保用品采购流标 保卫、消防劳保用品采购流标 猜你喜欢 更多 长春市 招标采购信息 灵宝市退役军人事务局办公家具采购项 11月01日 合肥电力安装有限公司巢湖分公司办公 11月01日 大学科技园众创空间二期家具采购项目 11月01日 折叠培训桌 11月01日 廉江市安铺镇中心卫生院办公用品采购 11月01日 陇西县李家龙宫旅游厕所建设项目中标 11月01日 合肥电力安装有限公司巢湖分公司办公 11月01日 山西大唐云冈热电办公桌椅等询价采购 11月01日 德州市德城区人民法院关于德州市德城 11月01日 日用杂品及劳保采购公告 11月01日 广州南联黑龙江分公司蔬菜干货类采购 11月01日 鄂伦春自治旗乌鲁布铁镇人民政府乌鲁 11月01日 长春市建材网 长春市采购信息网 长春市政府信息公开网 长春市公共资源交易网 长春市电力交易中心 长春市交易中心 长春市房产交易中心 长春市工程交易中心 长春市钢铁交易中心 长春市建设交易中心 长春市招投标交易中心 长春市政府交易中心 长春市造价信息网 长春市市政工程信息网 长春市水利工程信息网 长春市通信工程信息网 长春市医药招标网 长春市建筑招标网 长春市工程招标网 长春市建设招标网 长春市施工招标 长春市装饰工程招标 长春市建设工程网 长春市水利招标信息网 长春市电力招标网 长春市建委招投标网 长春市建筑管理网 长春市建设信息港 长春市教育招标网 长春市装修招标 长春市人力和社会保障局 长春市建设网 长春市总包工程 长春市政府工程招标 长春市工程施工招标 长春市工程公开项目 长春市工程采购信息 长春市招标投标采购平台 长春市省市工程建设网|2
